{
  "$schema": "https://json-schema.org/draft/2020-12/schema",
  "$id": "https://directive-engine.example/schemas/constraints.schema.json",
  "title": "Directive Engine - Constraints v0.1",
  "type": "object",
  "additionalProperties": false,
  "required": ["schema_version", "dataset_id", "engine_config", "parts"],
  "properties": {
    "schema_version": { "type": "string", "const": "v0.1" },
    "dataset_id": { "type": "string", "minLength": 1 },
    "engine_config": {
      "type": "object",
      "additionalProperties": false,
      "required": ["confidence_threshold"],
      "properties": {
        "confidence_threshold": {
          "type": "number",
          "minimum": 0.0,
          "maximum": 1.0,
          "description": "If pose_confidence < threshold, output status=needs_review."
        },
        "translation_clamp_policy": {
          "type": "string",
          "enum": ["none", "per_axis_max_abs", "vector_norm_max"],
          "default": "per_axis_max_abs"
        }
      }
    },
    "parts": {
      "type": "array",
      "minItems": 1,
      "items": { "$ref": "#/$defs/PartConstraint" }
    }
  },
  "$defs": {
    "AxisMask": {
      "type": "object",
      "additionalProperties": false,
      "required": ["x", "y", "z"],
      "properties": {
        "x": { "type": "boolean" },
        "y": { "type": "boolean" },
        "z": { "type": "boolean" }
      }
    },
    "RotationMode": {
      "type": "string",
      "enum": ["fixed", "free", "index"],
      "description": "fixed=no rotation allowed, free=continuous rotation allowed, index=discrete index positions allowed."
    },
    "PerAxisLimitMm": {
      "type": "object",
      "additionalProperties": false,
      "required": ["x", "y", "z"],
      "properties": {
        "x": { "type": "number", "minimum": 0.0 },
        "y": { "type": "number", "minimum": 0.0 },
        "z": { "type": "number", "minimum": 0.0 }
      },
      "description": "Max absolute translation correction along each axis (mm)."
    },
    "PerAxisLimitDeg": {
      "type": "object",
      "additionalProperties": false,
      "required": ["x", "y", "z"],
      "properties": {
        "x": { "type": "number", "minimum": 0.0 },
        "y": { "type": "number", "minimum": 0.0 },
        "z": { "type": "number", "minimum": 0.0 }
      },
      "description": "Max absolute rotation correction about each axis (deg)."
    },
    "IndexRotation": {
      "type": "object",
      "additionalProperties": false,
      "required": ["axis", "increment_deg", "allowed_indices", "nominal_index"],
      "properties": {
        "axis": { "type": "string", "enum": ["x", "y", "z"] },
        "increment_deg": { "type": "number", "exclusiveMinimum": 0.0 },
        "allowed_indices": {
          "type": "array",
          "minItems": 1,
          "items": { "type": "integer" },
          "description": "Discrete allowed index positions (integers)."
        },
        "nominal_index": {
          "type": "integer",
          "description": "Which index corresponds to nominal orientation."
        }
      }
    },
    "Vec3": {
      "type": "array",
      "minItems": 3,
      "maxItems": 3,
      "items": { "type": "number" }
    },
    "Feature": {
      "oneOf": [
        { "$ref": "#/$defs/JointFeature" },
        { "$ref": "#/$defs/SlotFeature" },
        { "$ref": "#/$defs/IndexFeature" }
      ]
    },
    "JointFeature": {
      "type": "object",
      "additionalProperties": false,
      "required": ["id", "kind", "position_mm", "axis"],
      "properties": {
        "id": { "type": "string", "minLength": 1, "description": "Short identifier, e.g. \"J1\"." },
        "kind": { "type": "string", "const": "joint" },
        "position_mm": {
          "$ref": "#/$defs/Vec3",
          "description": "Pivot point in part frame (mm)."
        },
        "axis": {
          "$ref": "#/$defs/Vec3",
          "description": "Rotation axis in part frame; need not be unit-length."
        },
        "description": { "type": "string" }
      }
    },
    "SlotFeature": {
      "type": "object",
      "additionalProperties": false,
      "required": ["id", "kind", "position_mm", "axis"],
      "properties": {
        "id": { "type": "string", "minLength": 1, "description": "Short identifier, e.g. \"S2\"." },
        "kind": { "type": "string", "const": "slot" },
        "position_mm": {
          "$ref": "#/$defs/Vec3",
          "description": "Reference point on the slot in part frame (mm)."
        },
        "axis": {
          "$ref": "#/$defs/Vec3",
          "description": "Slot translation axis in part frame; sign defines positive direction."
        },
        "description": { "type": "string" }
      }
    },
    "IndexFeature": {
      "type": "object",
      "additionalProperties": false,
      "required": ["id", "kind", "position_mm", "axis", "count"],
      "properties": {
        "id": { "type": "string", "minLength": 1, "description": "Short identifier, e.g. \"I1\"." },
        "kind": { "type": "string", "const": "index" },
        "position_mm": {
          "$ref": "#/$defs/Vec3",
          "description": "Center of indexed bolt pattern in part frame (mm)."
        },
        "axis": {
          "$ref": "#/$defs/Vec3",
          "description": "Rotation axis of the indexed pattern in part frame."
        },
        "count": {
          "type": "integer",
          "minimum": 2,
          "description": "Number of indexed positions around the axis."
        },
        "description": { "type": "string" }
      }
    },
    "Tolerances": {
      "type": "object",
      "additionalProperties": false,
      "required": ["translation_mm", "rotation_deg"],
      "properties": {
        "translation_mm": { "type": "number", "minimum": 0.0 },
        "rotation_deg": { "type": "number", "minimum": 0.0 }
      }
    },
    "PartConstraint": {
      "type": "object",
      "additionalProperties": false,
      "required": [
        "part_id",
        "allowed_translation_axes",
        "rotation_mode",
        "allowed_rotation_axes",
        "tolerances"
      ],
      "properties": {
        "part_id": { "type": "string", "minLength": 1 },
        "allowed_translation_axes": { "$ref": "#/$defs/AxisMask" },
        "rotation_mode": { "$ref": "#/$defs/RotationMode" },
        "allowed_rotation_axes": { "$ref": "#/$defs/AxisMask" },
        "translation_max_abs_mm": {
          "$ref": "#/$defs/PerAxisLimitMm",
          "description": "Per-axis clamp/limit for translation corrections."
        },
        "translation_max_norm_mm": {
          "type": "number",
          "minimum": 0.0,
          "description": "Max Euclidean norm of translation correction (mm). If violated => blocked."
        },
        "rotation_max_abs_deg": {
          "$ref": "#/$defs/PerAxisLimitDeg",
          "description": "Per-axis limit for rotation corrections (deg)."
        },
        "index_rotation": {
          "$ref": "#/$defs/IndexRotation",
          "description": "Required when rotation_mode='index'."
        },
        "tolerances": { "$ref": "#/$defs/Tolerances" },
        "features": {
          "type": "array",
          "items": { "$ref": "#/$defs/Feature" },
          "description": "Optional named kinematic features (joints, slots, indexed bolt patterns) used by the presentation layer to render directives in installer language. Ignored by the engine."
        },
        "verification": {
          "type": "object",
          "additionalProperties": false,
          "required": ["method"],
          "properties": {
            "method": {
              "type": "string",
              "enum": ["measure_pose", "re_scan", "manual_inspection"]
            },
            "notes": { "type": "string" }
          }
        }
      }
    }
  }
}

