{
  "schema_version": "v0.1",
  "dataset_id": "test_scan_pipeline_20260104",
  "engine_config": {
    "confidence_threshold": 0.5,
    "translation_clamp_policy": "per_axis_max_abs"
  },
  "parts": [
    {
      "part_id": "MULLION_PASS_WITHIN_TOL",
      "allowed_translation_axes": { "x": true, "y": true, "z": true },
      "rotation_mode": "fixed",
      "allowed_rotation_axes": { "x": false, "y": false, "z": false },
      "translation_max_abs_mm": { "x": 25, "y": 25, "z": 25 },
      "rotation_max_abs_deg": { "x": 0, "y": 0, "z": 0 },
      "tolerances": { "translation_mm": 5, "rotation_deg": 0.5 }
    },
    {
      "part_id": "MULLION_NEEDS_CORRECTION",
      "allowed_translation_axes": { "x": true, "y": true, "z": true },
      "rotation_mode": "fixed",
      "allowed_rotation_axes": { "x": false, "y": false, "z": false },
      "translation_max_abs_mm": { "x": 25, "y": 25, "z": 25 },
      "rotation_max_abs_deg": { "x": 0, "y": 0, "z": 0 },
      "tolerances": { "translation_mm": 5, "rotation_deg": 0.5 }
    },
    {
      "part_id": "MULLION_LARGE_ERROR",
      "allowed_translation_axes": { "x": true, "y": true, "z": true },
      "rotation_mode": "fixed",
      "allowed_rotation_axes": { "x": false, "y": false, "z": false },
      "translation_max_abs_mm": { "x": 25, "y": 25, "z": 25 },
      "rotation_max_abs_deg": { "x": 0, "y": 0, "z": 0 },
      "tolerances": { "translation_mm": 5, "rotation_deg": 0.5 }
    }
  ]
}
